{
  "artifact_type": "delta",
  "base_sha256": "d7a860409b97c2faa1cd4662286e5d61de3d8879c33d27379b20d8ba6dc8b2ec",
  "base_size": 11876,
  "base_vector": {
    "msp": "0x20005000",
    "reset": "0x08008DB9"
  },
  "base_version": 1,
  "delta_eligible": true,
  "operations": {
    "bkt_ops": 0,
    "count": 312,
    "del_ops": 6,
    "deleted_bytes": 13,
    "eql_ops": 156,
    "equal_bytes": 11668,
    "ins_ops": 7,
    "inserted_bytes": 25,
    "mod_ops": 143,
    "modified_bytes": 195
  },
  "patch_crc32": "0x84CB514A",
  "patch_format": "jojodiff-compatible-v1",
  "patch_ratio": 0.085885,
  "patch_sha256": "34d63a199aae161eca14fd1bdce42ea2736d390d0bdcc13511ac18f37d9b331c",
  "patch_size": 1021,
  "phase13_note": "STM32 delta application is intentionally not enabled until Phase 13.",
  "savings_percent": 91.41,
  "schema": 1,
  "selection_threshold_percent": 20.0,
  "target_crc32": "0x02904AA9",
  "target_load_address": "0x08006000",
  "target_sha256": "48a1a423b8dbdf44c8b0d23c1c4c7090f693ec28e5e8125aa8c2d2f7b2d3cd30",
  "target_size": 11888,
  "target_vector": {
    "msp": "0x20005000",
    "reset": "0x08008DC5"
  },
  "target_version": 2,
  "verification": {
    "byte_for_byte_target_match": true,
    "external_janpatch_checked": false,
    "internal_roundtrip": true
  }
}
